{
  "derived_model_version": "0.1.0",
  "artifact_type": "LifecycleRelationship",
  "regulator_profile": "core",
  "records": [
    {
      "lifecycle_relationship_id": "fixture.lifecycle.001",
      "guidance_family_id": "fixture.family.ich_m10",
      "from_document_edition_id": "fixture.edition.m10.final",
      "to_document_edition_id": "fixture.edition.m10.final",
      "relationship_type": "same edition",
      "original_relationship_wording": "fixture wording",
      "jurisdiction": "ICH",
      "source_references": [
        {
          "document_id": "ich_m10",
          "section_id": "ich_m10.sec.3_2_5_2",
          "source_unit_id": "ich_m10.su.3_2_5_2.001"
        }
      ],
      "review_status": "needs_review",
      "profile_details": null
    }
  ]
}
